<?xml version="1.0" encoding="UTF-8"?>
<!DOCTYPE messageobject SYSTEM "../GBMessages.dtd">

<messageobject extends="InfoMessage" message="SPW" name="Spawn" type="Event">
   <gbpackage name="GameBots2004"/>
   <gbpackage name="GBScenario"/>
   <gbpackage name="GameBotsAnim"/>
   <gbpackage name="GameBotsUE2"/>
   <gbpackage name="GBEmohawk"/>
   <group name="Bot"/>
   <group name="Observer"/>
   <documentation>
		Asynchronous message. You get this every time the bot gets
		respawned. When the match is not started yet and you connect to
		the server, there is delay in sending this message, it will be
		sent when the match will start, although the bot will be spawned
		in the game for a few seconds at that time.
	</documentation>
   <!-- Extra information used by different modules of the Pogamut platform. !--><extra>
      <code/>
   </extra>
</messageobject>