<?xml version="1.0" encoding="UTF-8"?>
<!DOCTYPE commandobject SYSTEM "../GBMessages.dtd">

<commandobject command="STOP" extends="CommandMessage" name="Stop" type="Control">
   <gbpackage name="GameBots2004"/>
   <gbpackage name="GBScenario"/>
   <gbpackage name="GameBotsAnim"/>
   <gbpackage name="GameBotsUE2"/>
   <gbpackage name="GBEmohawk"/>
   <group name="Bot"/>
   <documentation>Stop all movement.</documentation>
   <!-- List of all properties of this command. !--><!-- Extra information used by different modules of the Pogamut platform. !--><extra>
      <code/>
   </extra>
</commandobject>