<?xml version="1.0" encoding="UTF-8"?>
<!DOCTYPE messageobject SYSTEM "../GBMessages.dtd">

<messageobject extends="InfoMessage" message="SPTH" name="PathListStart" type="Batch">
   <gbpackage name="GameBots2004"/>
   <gbpackage name="GBScenario"/>
   <gbpackage name="GameBotsAnim"/>
   <gbpackage name="GameBotsUE2"/>
   <gbpackage name="GBEmohawk"/>
   <group name="Bot"/>
   <documentation>
		Start of the path list sent as an response to GETPATH command
		(IPTH messages).
	</documentation>
   <!-- Extra information used by different modules of the Pogamut platform. !--><property name="MessageId" type="String">
      <documentation>
			An Id matching the one sent by client. Allows bot to match
			answer with right query.
		</documentation>
   </property>
   <extra>
      <code/>
   </extra>
</messageobject>