<?xml version="1.0" encoding="UTF-8"?>
<!DOCTYPE commandobject SYSTEM "../GBMessages.dtd">

<commandobject command="SETPASS" extends="CommandMessage" name="SetPassword" type="Configure">
   <gbpackage name="GameBots2004"/>
   <gbpackage name="GBScenario"/>
   <gbpackage name="GameBotsAnim"/>
   <gbpackage name="GameBotsUE2"/>
   <gbpackage name="GBEmohawk"/>
   <group name="Server"/>
   <documentation>
		Sets the password for Bot and control connections. If the
		password is set the initiation of GB communication is changed to
		this: 1) A ---&gt; GB sends HELLO message 2) B &lt;--- user
		sends READY 3) C ... if the server is protected by pass: 3.a) C1
		---&gt; GB sends PASSWORD {BlockedByIP="ip adress with port of
		the blocker (195.113.12.3:3001)"} 3.b) C2 &lt;--- user sends
		password ( PASSWORD {Password pass}) ... if correct 3.c) C3
		---&gt; GB sends PASSWDOK and info batch messages, user can
		continue normally .... if the password is wrong 3.d) C4 ---&gt;
		PASSWDWRONG and connection ends Note: If the user knows that
		server is passworded he can use PASSWORD {Password pass} command
		instead of READY, and will be checked and sent info batch
		messages immediately
	</documentation>
   <!-- List of all properties of this command. !--><property name="Password" type="String">
      <documentation>Holds the password.</documentation>
   </property>
   <!-- Extra information used by different modules of the Pogamut platform. !--><extra>
      <code/>
   </extra>
</commandobject>