<?xml version="1.0" encoding="UTF-8"?>
<!DOCTYPE messageobject SYSTEM "../GBMessages.dtd">

<messageobject extends="InfoMessage" message="MAPCHANGE" name="MapChange" type="Event">
   <gbpackage name="GameBots2004"/>
   <gbpackage name="GBScenario"/>
   <gbpackage name="GameBotsAnim"/>
   <gbpackage name="GameBotsUE2"/>
   <gbpackage name="GBEmohawk"/>
   <group name="Bot"/>
   <group name="Server"/>
   <documentation>
		Asynchronous message. Sent when the map is changed (we will
		loose connection to the server for some time).
	</documentation>
   <!-- List of all properties of this message. !--><property name="MapName" type="String" category="shared">
      <documentation>Name of the new map.</documentation>
   </property>
   <!-- Extra information used by different modules of the Pogamut platform. !--><extra>
      <code/>
   </extra>
</messageobject>