<?xml version="1.0" encoding="UTF-8"?>
<!DOCTYPE commandobject SYSTEM "../GBMessages.dtd">

<commandobject command="GETITC" extends="CommandMessage" name="GetItemCategory" type="Info">
   <gbpackage name="GameBots2004"/>
   <gbpackage name="GBScenario"/>
   <gbpackage name="GameBotsAnim"/>
   <gbpackage name="GameBotsUE2"/>
   <gbpackage name="GBEmohawk"/>
   <group name="Bot"/>
   <group name="Observer"/>
   <documentation>
		Request to export item category by ITC message. Will respond with ITC message.
	</documentation>
   <!-- List of all properties of this command. !--><property name="Type" type="String">
      <documentation>
			Class of the item we want to export ITC message for. Must be pickup class (e.g.
			xWeapons.FlakCannonPickup).
		</documentation>
   </property>
   <!-- Extra information used by different modules of the Pogamut platform. !--><extra>
      <code/>
   </extra>
</commandobject>