<?xml version="1.0" encoding="UTF-8"?>
<!DOCTYPE commandobject SYSTEM "../GBMessages.dtd">

<commandobject command="SPECIAL" extends="CommandMessage" name="GetSpecialObjects" type="Info">
   <gbpackage name="GameBots2004"/>
   <gbpackage name="GBScenario"/>
   <gbpackage name="GameBotsAnim"/>
   <group name="Observer"/>
   <documentation>
		Request messages about special objects on the map.
        The observer will send FLG, BOM and DOM messages.
	</documentation>
   <!-- List of all properties of this command. !--><!-- Extra information used by different modules of the Pogamut platform. !--><extra>
      <code/>
   </extra>
</commandobject>